{"schemaVersion":"property-reference-corpus-v1","corpusVersion":"2026-09-02.2","split":"HELD_OUT","auctions":[{"auctionId":66413,"snapshotSha256":"9fa3f177e2168da9b78ea117e2441187946a2d0f466aba119d5550432c74e6cc","split":"HELD_OUT","category":"Пољопривредно земљиште","caseStatus":"REFERENCES_PRESENT","patternTags":["CYRILLIC","LAND_REGISTER","MULTIPLE_REFERENCES","PARCEL_SUFFIX"],"sourceFieldHashes":{"descriptionSha256":"186e0fdcf2a1f4bfd0a0c930f3abc71059337aaca17d57a088ac033f58f20e1f","shortDescriptionSha256":"186e0fdcf2a1f4bfd0a0c930f3abc71059337aaca17d57a088ac033f58f20e1f"},"evidence":[{"sourceField":"detail.Description","text":"парц.бр.3268/1"},{"sourceField":"detail.Description","text":"К.О.Нови Кнежевац"},{"sourceField":"detail.Description","text":"ЛН 4797"}],"expectedReferences":[{"annotationId":"a66413-r01","type":"PARCEL","pattern":"PARCEL_ABBREVIATED","evidenceIndex":0,"rawEvidence":"парц.бр.3268/1","koName":"НОВИ КНЕЖЕВАЦ","koCode":"801941","parcelNumber":"3268/1","landRegisterNumber":null,"addressTokens":null},{"annotationId":"a66413-r02","type":"CADASTRAL_MUNICIPALITY","pattern":"KO_ABBREVIATED","evidenceIndex":1,"rawEvidence":"К.О.Нови Кнежевац","koName":"НОВИ КНЕЖЕВАЦ","koCode":"801941","parcelNumber":null,"landRegisterNumber":null,"addressTokens":null},{"annotationId":"a66413-r03","type":"LAND_REGISTER","pattern":"LAND_REGISTER_ABBREVIATED","evidenceIndex":2,"rawEvidence":"ЛН 4797","koName":"НОВИ КНЕЖЕВАЦ","koCode":"801941","parcelNumber":null,"landRegisterNumber":"4797","addressTokens":null}],"reviewStatus":"ADJUDICATED","adjudicationIds":[]},{"auctionId":179104,"snapshotSha256":"dbbe14f54f021df41daea699a43b072448abad3a7c7fabfdd9eb481ad38104e9","split":"HELD_OUT","category":"Шумско земљиште","caseStatus":"REFERENCES_PRESENT","patternTags":["ADDRESS","CYRILLIC","FALSE_POSITIVE_TRAP","LAND_REGISTER","MULTIPLE_REFERENCES"],"sourceFieldHashes":{"descriptionSha256":"0a60994430c37ab39c85782ec0c89d36209d3fc5104752b2341b3713a66d7836","shortDescriptionSha256":"044486002c643a9b2e069b7875dd954385a52c1daeebf522d680368ef063615d"},"evidence":[{"sourceField":"detail.Description","text":"К.П.бр.7475"},{"sourceField":"detail.Description","text":"Улица / Потес: ПУЈЧИНА ПАДИНА"},{"sourceField":"detail.Description","text":"Л.Н.бр.183"},{"sourceField":"detail.Description","text":"К.О. Горња Бела Река"},{"sourceField":"detail.Description","text":"Бр.дела парцеле: 1"}],"expectedReferences":[{"annotationId":"a179104-r01","type":"PARCEL","pattern":"PARCEL_ABBREVIATED","evidenceIndex":0,"rawEvidence":"К.П.бр.7475","koName":"ГОРЊА БЕЛА РЕКА","koCode":"715760","parcelNumber":"7475","landRegisterNumber":null,"addressTokens":null},{"annotationId":"a179104-r02","type":"ADDRESS","pattern":"ADDRESS_LABELED","evidenceIndex":1,"rawEvidence":"Улица / Потес: ПУЈЧИНА ПАДИНА","koName":"ГОРЊА БЕЛА РЕКА","koCode":"715760","parcelNumber":null,"landRegisterNumber":null,"addressTokens":["ПУЈЧИНА ПАДИНА"]},{"annotationId":"a179104-r03","type":"LAND_REGISTER","pattern":"LAND_REGISTER_ABBREVIATED","evidenceIndex":2,"rawEvidence":"Л.Н.бр.183","koName":"ГОРЊА БЕЛА РЕКА","koCode":"715760","parcelNumber":null,"landRegisterNumber":"183","addressTokens":null},{"annotationId":"a179104-r04","type":"CADASTRAL_MUNICIPALITY","pattern":"KO_ABBREVIATED","evidenceIndex":3,"rawEvidence":"К.О. Горња Бела Река","koName":"ГОРЊА БЕЛА РЕКА","koCode":"715760","parcelNumber":null,"landRegisterNumber":null,"addressTokens":null}],"reviewStatus":"ADJUDICATED","adjudicationIds":[]},{"auctionId":179181,"snapshotSha256":"390fd84ec0e67d76e99250bf34b1fb8f8cc75256291542ca8bf4ed97a4210a04","split":"HELD_OUT","category":"Непокретности","caseStatus":"REFERENCES_PRESENT","patternTags":["CYRILLIC","MALFORMED_PROSE","MISSING_FIELDS"],"sourceFieldHashes":{"descriptionSha256":"a697f7f2c94362318a0ead93e00c3f21692b1e0571f044956447ac0caef12c47","shortDescriptionSha256":"a697f7f2c94362318a0ead93e00c3f21692b1e0571f044956447ac0caef12c47"},"evidence":[{"sourceField":"detail.Description","text":"Кат.прцела 331"}],"expectedReferences":[{"annotationId":"a179181-r01","type":"PARCEL","pattern":"PARCEL_MALFORMED_LABEL","evidenceIndex":0,"rawEvidence":"Кат.прцела 331","koName":"ВЕЛИКА ДРЕНОВА","koCode":"741531","parcelNumber":"331","landRegisterNumber":null,"addressTokens":null}],"reviewStatus":"ADJUDICATED","adjudicationIds":["adj-179181-malformed-label"]},{"auctionId":179368,"snapshotSha256":"10eafe5703cc3e3b6a252b7974f263bab6f9aaa672d029db7ee51b524654c5c4","split":"HELD_OUT","category":"Парцела","caseStatus":"REFERENCES_PRESENT","patternTags":["ADDRESS","CYRILLIC","LAND_REGISTER","MALFORMED_PROSE","MULTIPLE_REFERENCES"],"sourceFieldHashes":{"descriptionSha256":"864511ede2dc96cb2f8d516410e3fcf8e0dde926c7eb8fd03bb2c44401b5fd6a","shortDescriptionSha256":"c39a0d3d578401eb830aee4aad984e0009cc86163dfb487c71e5146969efbbc1"},"evidence":[{"sourceField":"detail.Description","text":"Кат.парц.бр. 4384"},{"sourceField":"detail.Description","text":"Кат.парц.бр.  4385"},{"sourceField":"detail.Description","text":"Кат.парц.бр. 4386"},{"sourceField":"detail.Description","text":"Улица / Потес: ЈУРАЈА ВИТЕЗА"},{"sourceField":"detail.Description","text":"Улица / Потес: КОШЕВАЦ"},{"sourceField":"detail.Description","text":"листу непокретности бр. 897"},{"sourceField":"detail.Description","text":"К.О. Нови Сланкамен"}],"expectedReferences":[{"annotationId":"a179368-r01","type":"PARCEL","pattern":"PARCEL_ABBREVIATED","evidenceIndex":0,"rawEvidence":"Кат.парц.бр. 4384","koName":"НОВИ СЛАНКАМЕН","koCode":"805343","parcelNumber":"4384","landRegisterNumber":null,"addressTokens":null},{"annotationId":"a179368-r02","type":"PARCEL","pattern":"PARCEL_ABBREVIATED","evidenceIndex":1,"rawEvidence":"Кат.парц.бр.  4385","koName":"НОВИ СЛАНКАМЕН","koCode":"805343","parcelNumber":"4385","landRegisterNumber":null,"addressTokens":null},{"annotationId":"a179368-r03","type":"PARCEL","pattern":"PARCEL_ABBREVIATED","evidenceIndex":2,"rawEvidence":"Кат.парц.бр. 4386","koName":"НОВИ СЛАНКАМЕН","koCode":"805343","parcelNumber":"4386","landRegisterNumber":null,"addressTokens":null},{"annotationId":"a179368-r04","type":"ADDRESS","pattern":"ADDRESS_LABELED","evidenceIndex":3,"rawEvidence":"Улица / Потес: ЈУРАЈА ВИТЕЗА","koName":"НОВИ СЛАНКАМЕН","koCode":"805343","parcelNumber":null,"landRegisterNumber":null,"addressTokens":["ЈУРАЈА ВИТЕЗА"]},{"annotationId":"a179368-r05","type":"ADDRESS","pattern":"ADDRESS_LABELED","evidenceIndex":4,"rawEvidence":"Улица / Потес: КОШЕВАЦ","koName":"НОВИ СЛАНКАМЕН","koCode":"805343","parcelNumber":null,"landRegisterNumber":null,"addressTokens":["КОШЕВАЦ"]},{"annotationId":"a179368-r06","type":"LAND_REGISTER","pattern":"LAND_REGISTER_LABELED","evidenceIndex":5,"rawEvidence":"листу непокретности бр. 897","koName":"НОВИ СЛАНКАМЕН","koCode":"805343","parcelNumber":null,"landRegisterNumber":"897","addressTokens":null},{"annotationId":"a179368-r07","type":"CADASTRAL_MUNICIPALITY","pattern":"KO_ABBREVIATED","evidenceIndex":6,"rawEvidence":"К.О. Нови Сланкамен","koName":"НОВИ СЛАНКАМЕН","koCode":"805343","parcelNumber":null,"landRegisterNumber":null,"addressTokens":null}],"reviewStatus":"ADJUDICATED","adjudicationIds":["adj-179368-ko-conflict"]},{"auctionId":179620,"snapshotSha256":"f702dbdff25a562d0ac684ed6451a4f7d0f4456f2cb271b7f9260a6cdffc912d","split":"HELD_OUT","category":"Остало земљиште","caseStatus":"NO_DESCRIPTION_REFERENCE","patternTags":["CYRILLIC","FALSE_POSITIVE_TRAP","MISSING_FIELDS","NEGATIVE"],"sourceFieldHashes":{"descriptionSha256":"5ff0a7b65297d9396c30bcd4a1cf52cf2f7f1ef9e27ca0839600dca80be3fcc2","shortDescriptionSha256":"733fcaf42317dbe5edc9ad6a67e8ef31433227810aeed69aba44e278c10307ed"},"evidence":[{"sourceField":"detail.Description","text":"Површина парцеле (м2): 934, Број дела парцеле: 1, Површина дела парцеле (м2): 934"}],"expectedReferences":[],"reviewStatus":"ADJUDICATED","adjudicationIds":[]},{"auctionId":179642,"snapshotSha256":"3fdf326247c586a95969cb7409f32669cc557e56a4a4a67f072f1f09f0cf01a5","split":"HELD_OUT","category":"Кућа","caseStatus":"NO_DESCRIPTION_REFERENCE","patternTags":["CYRILLIC","MISSING_FIELDS","NEGATIVE"],"sourceFieldHashes":{"descriptionSha256":"d43b59ac8e5bd1b2e23701a4b75b1acc6ffb5cb5500aa8b9c4caff8904860e0e","shortDescriptionSha256":"b336b1e20842e1a4d3ed5c7c8d2a0bdc7d42e28e4defd92d8384bff507fe538d"},"evidence":[{"sourceField":"detail.Description","text":"3.објекта"}],"expectedReferences":[],"reviewStatus":"ADJUDICATED","adjudicationIds":[]},{"auctionId":180293,"snapshotSha256":"4f3b373360813f8e3350bfd7d9124c7a85aecee52a6572ae0d2301a82709f50a","split":"HELD_OUT","category":"Непокретности","caseStatus":"REFERENCES_PRESENT","patternTags":["LATIN","MULTIPLE_REFERENCES"],"sourceFieldHashes":{"descriptionSha256":"cea14ecb66558d07cf33540538276f52e6c6efeb19ad3d52e915e6ee8c800660","shortDescriptionSha256":"cea14ecb66558d07cf33540538276f52e6c6efeb19ad3d52e915e6ee8c800660"},"evidence":[{"sourceField":"detail.Description","text":"KP 1928"},{"sourceField":"detail.Description","text":"KO KUZMIN"}],"expectedReferences":[{"annotationId":"a180293-r01","type":"PARCEL","pattern":"PARCEL_LATIN_ABBREVIATED","evidenceIndex":0,"rawEvidence":"KP 1928","koName":"КУЗМИН","koCode":"804142","parcelNumber":"1928","landRegisterNumber":null,"addressTokens":null},{"annotationId":"a180293-r02","type":"CADASTRAL_MUNICIPALITY","pattern":"KO_LATIN","evidenceIndex":1,"rawEvidence":"KO KUZMIN","koName":"КУЗМИН","koCode":"804142","parcelNumber":null,"landRegisterNumber":null,"addressTokens":null}],"reviewStatus":"ADJUDICATED","adjudicationIds":[]},{"auctionId":180865,"snapshotSha256":"f295eaed2f1225fcc694e972bc0884ee3f242af8abba6d28a460fc33ae063421","split":"HELD_OUT","category":"Стан","caseStatus":"REFERENCES_PRESENT","patternTags":["ADDRESS","CYRILLIC","MULTIPLE_REFERENCES"],"sourceFieldHashes":{"descriptionSha256":"e536b0c1a40588097f403fb1d0590cf392c78b2ae959933b40273934d1d1051f","shortDescriptionSha256":"610d6f478619b284527b79977e084a16c0ad45fd7829dd8bf5159c9e713f115c"},"evidence":[{"sourceField":"de